slug,title,category,tags,summary,col_labels,compare_rows,article_title,article_lead,exam_points,common_mistakes,memory_tip,related_terms,faq_1_question,faq_1_answer,faq_2_question,faq_2_answer,faq_3_question,faq_3_answer,faq_4_question,faq_4_answer
work-env-rating-standard-compare-s33,作業環境評定基準の比較,労働衛生,管理区分;作業環境測定,作業環境の評定基準と管理区分の使い分けを比較し、測定後の行動を整理します。,評定基準;区分措置,"[{""axis"": ""評価軸"", ""cols"": [""管理区分（第1〜第3）の評価"", ""最重要管理区分""]}, {""axis"": ""測定"", ""cols"": [""A測定・B測定・C測定の意味と使い分け"", ""作業環境測定""]}, {""axis"": ""措置"", ""cols"": [""作業環境評価基準・管理区分（第1～第3）"", ""改善計画を作成""]}, {""axis"": ""保存"", ""cols"": [""記録の作成・保存（測定・健康診断・教育等）"", ""監査対応で活用""]}, {""axis"": ""誤答傾向"", ""cols"": [""区分と測定の逆転"", ""保存期間の混同""]}]",作業環境評定基準｜S33,評定基準は測定値の解釈、管理区分は措置選択の根拠として使います。,評価軸を区別;A/B/C測定の位置づけ;記録活用,管理区分だけ覚えて評定根拠を説明できないまま選択肢を判断する誤りが生じやすい。,測定値は評定に、評定は措置に使う。,作業環境評価基準・管理区分（第1～第3）;A測定・B測定・C測定の意味と使い分け;作業環境測定（義務・頻度・評価・記録）,作業環境評定基準の学習で最初に確認する点は？,作業環境評定基準は条文上の定義、対象業務、義務主体、記録保存までを一連で押さえると得点が安定します。単語だけでなく手順順序を確認し、誤肢の逆張りに強くなることが重要です。 試験では評価軸を区別をセットで確認してください。,頻出のひっかけは？,人数基準、実施周期、保存期間、委員会や選任主体の取り違えが頻出です。設問文の主語と対象業務を先に確定し、数値を最後に照合すると誤答を減らせます。 試験では評価軸を区別をセットで確認してください。 誤答では管理区分だけ覚えて評定根拠を説明できないまま選択肢を判断する誤りが生じやすい。に注意してください。,実務と試験を両立する覚え方は？,法令フローを「対象確認→実施→記録→事後措置」で統一し、過去問を同じ順序で色分けしてください。この方法で初見問題でも論点位置を素早く特定できます。 試験では評価軸を区別をセットで確認してください。 誤答では管理区分だけ覚えて評定根拠を説明できないまま選択肢を判断する誤りが生じやすい。に注意してください。,直前期の確認ポイントは？,比較表と数値一覧を毎日短時間で回し、誤答だけを再演習するのが効率的です。特に第一種は有害業務分野の取りこぼしが合否を分けるため、弱点範囲を残さないことが重要です。 試験では評価軸を区別をセットで確認してください。
management-category-change-compare-s33,管理区分変更時の判断比較,労働衛生,管理区分;リスクアセスメント,管理区分変更時に必要な再測定・リスク評価・記録更新の関係を比較します。,変更契機;更新手順,"[{""axis"": ""変更契機"", ""cols"": [""管理区分（第1〜第3）の評価"", ""設備・工程変更時""]}, {""axis"": ""再評価"", ""cols"": [""作業環境測定機器の校正・保守"", ""作業環境測定結果の評価・公表（概念）""]}, {""axis"": ""リスク"", ""cols"": [""リスクアセスメント（化学・作業環境）"", ""化学物質管理者（選任・職務）""]}, {""axis"": ""記録"", ""cols"": [""特定化学物質の記録保存・提示・監督署報告"", ""更新履歴を保存""]}, {""axis"": ""誤答傾向"", ""cols"": [""変更後再評価を省略"", ""責任者の不明確化""]}]",管理区分変更の比較｜S33,区分変更問題は『変更理由→再評価→記録更新』の順序確認が得点源です。,変更契機の特定;再評価必須;責任者明確化,変更後に旧区分のまま運用し、再測定と記録更新を省く手順ミスが起こりやすい。,区分変更は必ず再評価とセットで覚える。,作業環境評価基準・管理区分（第1～第3）;作業環境測定（義務・頻度・評価・記録）;リスクアセスメント（化学・作業環境）,管理区分変更の学習で最初に確認する点は？,管理区分変更は条文上の定義、対象業務、義務主体、記録保存までを一連で押さえると得点が安定します。単語だけでなく手順順序を確認し、誤肢の逆張りに強くなることが重要です。 試験では変更契機の特定をセットで確認してください。,頻出のひっかけは？,人数基準、実施周期、保存期間、委員会や選任主体の取り違えが頻出です。設問文の主語と対象業務を先に確定し、数値を最後に照合すると誤答を減らせます。 試験では変更契機の特定をセットで確認してください。 誤答では変更後に旧区分のまま運用し、再測定と記録更新を省く手順ミスが起こりやすい。に注意してください。,実務と試験を両立する覚え方は？,法令フローを「対象確認→実施→記録→事後措置」で統一し、過去問を同じ順序で色分けしてください。この方法で初見問題でも論点位置を素早く特定できます。 試験では変更契機の特定をセットで確認してください。 誤答では変更後に旧区分のまま運用し、再測定と記録更新を省く手順ミスが起こりやすい。に注意してください。,直前期の確認ポイントは？,比較表と数値一覧を毎日短時間で回し、誤答だけを再演習するのが効率的です。特に第一種は有害業務分野の取りこぼしが合否を分けるため、弱点範囲を残さないことが重要です。 試験では変更契機の特定をセットで確認してください。
exam44-subject-balance-compare-s33,44問科目別攻略の比較,関係法令,44問;科目配分,44問の科目別配分と足切り回避の学習配分を比較して整理します。,配点管理;学習配分,"[{""axis"": ""構成"", ""cols"": [""44問5範囲"", ""有害業務を含む""]}, {""axis"": ""合格基準"", ""cols"": [""総合240点"", ""各範囲40点""]}, {""axis"": ""戦略"", ""cols"": [""弱点範囲を週次補強"", ""得意科目依存を回避""]}, {""axis"": ""確認"", ""cols"": [""模試で範囲別点検"", ""直前は誤答だけ再演習""]}, {""axis"": ""誤答傾向"", ""cols"": [""総合点のみ意識"", ""足切り軽視""]}]",44問科目別攻略｜S33,第一種は範囲別40点を落とさない設計が必須で、配点管理の精度が合否を左右します。,44問5範囲;総合240点;範囲別40点,総合得点だけを追って範囲別40点未満を放置すると、本番で足切り不合格になりやすい。,総合点より先に足切り回避を確定する。,衛生工学衛生管理者（有害業務での選任）;衛生管理者（選任・常勤・専任・資格区分）;労働安全衛生法,44問科目別の学習で最初に確認する点は？,44問科目別は条文上の定義、対象業務、義務主体、記録保存までを一連で押さえると得点が安定します。単語だけでなく手順順序を確認し、誤肢の逆張りに強くなることが重要です。 試験では44問5範囲をセットで確認してください。,頻出のひっかけは？,人数基準、実施周期、保存期間、委員会や選任主体の取り違えが頻出です。設問文の主語と対象業務を先に確定し、数値を最後に照合すると誤答を減らせます。 試験では44問5範囲をセットで確認してください。 誤答では総合得点だけを追って範囲別40点未満を放置すると、本番で足切り不合格になりやすい。に注意してください。,実務と試験を両立する覚え方は？,法令フローを「対象確認→実施→記録→事後措置」で統一し、過去問を同じ順序で色分けしてください。この方法で初見問題でも論点位置を素早く特定できます。 試験では44問5範囲をセットで確認してください。 誤答では総合得点だけを追って範囲別40点未満を放置すると、本番で足切り不合格になりやすい。に注意してください。,直前期の確認ポイントは？,比較表と数値一覧を毎日短時間で回し、誤答だけを再演習するのが効率的です。特に第一種は有害業務分野の取りこぼしが合否を分けるため、弱点範囲を残さないことが重要です。 試験では44問5範囲をセットで確認してください。
exclusive-fulltime-appointment-compare-s33,選任・常勤・専任の比較,関係法令,衛生管理者;専任,衛生管理者の選任、常勤、専任の条件を比較し、有害業務論点を整理します。,選任条件;専任要件,"[{""axis"": ""資格"", ""cols"": [""衛生管理者（選任・常勤・専任・資格区分）"", ""衛生工学衛生管理者（有害業務での選任）""]}, {""axis"": ""人数基準"", ""cols"": [""専任の衛生管理者（有害業務30人超）"", ""安全衛生管理体制（総括／衛生管理者／産業医）""]}, {""axis"": ""実務"", ""cols"": [""衛生管理者の職場巡視（週1回）"", ""記録の作成・保存（測定・健康診断・教育等）""]}, {""axis"": ""委員会"", ""cols"": [""衛生委員会"", ""総括安全衛生管理者""]}, {""axis"": ""誤答傾向"", ""cols"": [""第二種で有害担当"", ""巡視義務の混同""]}]",選任・常勤・専任の比較｜S33,選任論点は人数基準と有害業務の組み合わせで判断するのが基本です。,資格区分;30人超要件;巡視義務,有害業務でも第二種で足りると誤解し、専任要件と巡視義務を同時に落とす誤りが頻発する。,有害業務は第一種と専任を同時に確認する。,衛生管理者（選任・常勤・専任・資格区分）;専任の衛生管理者（有害業務30人超）;衛生管理者の職場巡視（週1回）,選任常勤専任の学習で最初に確認する点は？,選任常勤専任は条文上の定義、対象業務、義務主体、記録保存までを一連で押さえると得点が安定します。単語だけでなく手順順序を確認し、誤肢の逆張りに強くなることが重要です。 試験では資格区分をセットで確認してください。,頻出のひっかけは？,人数基準、実施周期、保存期間、委員会や選任主体の取り違えが頻出です。設問文の主語と対象業務を先に確定し、数値を最後に照合すると誤答を減らせます。 試験では資格区分をセットで確認してください。 誤答では有害業務でも第二種で足りると誤解し、専任要件と巡視義務を同時に落とす誤りが頻発する。に注意してください。,実務と試験を両立する覚え方は？,法令フローを「対象確認→実施→記録→事後措置」で統一し、過去問を同じ順序で色分けしてください。この方法で初見問題でも論点位置を素早く特定できます。 試験では資格区分をセットで確認してください。 誤答では有害業務でも第二種で足りると誤解し、専任要件と巡視義務を同時に落とす誤りが頻発する。に注意してください。,直前期の確認ポイントは？,比較表と数値一覧を毎日短時間で回し、誤答だけを再演習するのが効率的です。特に第一種は有害業務分野の取りこぼしが合否を分けるため、弱点範囲を残さないことが重要です。 試験では資格区分をセットで確認してください。
health-check-result-handling-compare-s33,健康診断結果取扱いの比較,労働衛生,健康診断;事後措置,健康診断結果の通知・保存・就業上措置の流れを比較し、法令順序を定着させます。,通知手順;事後措置,"[{""axis"": ""通知"", ""cols"": [""健康診断結果の本人通知"", ""健康診断結果報告書（特殊・定期）""]}, {""axis"": ""保存"", ""cols"": [""健康診断個人票の保存（5年）"", ""記録の作成・保存（測定・健康診断・教育等）""]}, {""axis"": ""措置"", ""cols"": [""健康診断事後措置"", ""二次健康診断等給付（労災）""]}, {""axis"": ""対象"", ""cols"": [""定期健康診断／雇入時／特殊健康診断"", ""特定業務従事者の健康診断""]}, {""axis"": ""誤答傾向"", ""cols"": [""通知で完了扱い"", ""保存期間の混同""]}]",健診結果取扱い比較｜S33,健診結果は通知・保存・事後措置の三段階で整理すると誤答を抑えられます。,通知と保存;5年保存;事後措置の接続,本人通知だけで法令対応が完了すると誤認し、就業上措置や保存年限を漏らす誤りが多い。,健診は通知で終わらず措置まで追う。,健康診断結果の本人通知;健康診断個人票の保存（5年）;健康診断事後措置,健康診断結果取扱の学習で最初に確認する点は？,健康診断結果取扱は条文上の定義、対象業務、義務主体、記録保存までを一連で押さえると得点が安定します。単語だけでなく手順順序を確認し、誤肢の逆張りに強くなることが重要です。 試験では通知と保存をセットで確認してください。,頻出のひっかけは？,人数基準、実施周期、保存期間、委員会や選任主体の取り違えが頻出です。設問文の主語と対象業務を先に確定し、数値を最後に照合すると誤答を減らせます。 試験では通知と保存をセットで確認してください。 誤答では本人通知だけで法令対応が完了すると誤認し、就業上措置や保存年限を漏らす誤りが多い。に注意してください。,実務と試験を両立する覚え方は？,法令フローを「対象確認→実施→記録→事後措置」で統一し、過去問を同じ順序で色分けしてください。この方法で初見問題でも論点位置を素早く特定できます。 試験では通知と保存をセットで確認してください。 誤答では本人通知だけで法令対応が完了すると誤認し、就業上措置や保存年限を漏らす誤りが多い。に注意してください。,直前期の確認ポイントは？,比較表と数値一覧を毎日短時間で回し、誤答だけを再演習するのが効率的です。特に第一種は有害業務分野の取りこぼしが合否を分けるため、弱点範囲を残さないことが重要です。 試験では通知と保存をセットで確認してください。
chemical-survey-flow-compare-s33,化学物質調査フロー比較,労働衛生,化学物質;リスクアセスメント,化学物質調査からリスクアセスメント、教育までの実施フローを比較します。,調査段階;措置段階,"[{""axis"": ""調査"", ""cols"": [""化学物質管理者（選任・職務）"", ""作業環境測定結果の評価・公表（概念）""]}, {""axis"": ""評価"", ""cols"": [""リスクアセスメント（化学・作業環境）"", ""作業環境測定結果の報告（監督署）""]}, {""axis"": ""措置"", ""cols"": [""特定化学物質障害予防規則（区分・技術的措置）"", ""作業環境測定（義務・頻度・評価・記録）""]}, {""axis"": ""教育"", ""cols"": [""安全衛生教育"", ""安全衛生教育／特別教育／職長教育／技能講習""]}, {""axis"": ""誤答傾向"", ""cols"": [""SDSだけで完了"", ""評価順序の逆転""]}]",化学物質調査フロー｜S33,調査と評価を分離せず、措置と教育までつなげるのが第一種の基本です。,調査→評価→措置→教育;責任者明確化;記録,SDSや表示だけで調査と評価を省略し、フロー全体を分断してしまう誤りが典型。,化学管理は順序を崩さず一本化する。,化学物質管理者（選任・職務）;リスクアセスメント（化学・作業環境）;作業環境測定結果の評価・公表（概念）,化学物質調査の学習で最初に確認する点は？,化学物質調査は条文上の定義、対象業務、義務主体、記録保存までを一連で押さえると得点が安定します。単語だけでなく手順順序を確認し、誤肢の逆張りに強くなることが重要です。 試験では調査→評価→措置→教育をセットで確認してください。,頻出のひっかけは？,人数基準、実施周期、保存期間、委員会や選任主体の取り違えが頻出です。設問文の主語と対象業務を先に確定し、数値を最後に照合すると誤答を減らせます。 試験では調査→評価→措置→教育をセットで確認してください。,実務と試験を両立する覚え方は？,法令フローを「対象確認→実施→記録→事後措置」で統一し、過去問を同じ順序で色分けしてください。この方法で初見問題でも論点位置を素早く特定できます。 試験では調査→評価→措置→教育をセットで確認してください。,直前期の確認ポイントは？,比較表と数値一覧を毎日短時間で回し、誤答だけを再演習するのが効率的です。特に第一種は有害業務分野の取りこぼしが合否を分けるため、弱点範囲を残さないことが重要です。 試験では調査→評価→措置→教育をセットで確認してください。
safety-hygiene-education-compare-s33,安全衛生教育の区分比較,関係法令,安全衛生教育;雇入れ時,雇入れ時教育と特別教育・技能講習の違いを比較し、義務主体を整理します。,教育目的;対象作業,"[{""axis"": ""雇入れ時"", ""cols"": [""雇入れ時の安全衛生教育（安衛則35条）"", ""安全衛生教育""]}, {""axis"": ""職種変更時"", ""cols"": [""安全衛生教育／特別教育／職長教育／技能講習"", ""教育内容を更新""]}, {""axis"": ""特別教育"", ""cols"": [""石綿取扱業務の特別教育"", ""危険有害業務で実施""]}, {""axis"": ""技能講習"", ""cols"": [""特定粉じん作業／有機溶剤等作業／特定化学物質等作業主任者"", ""作業主任者選任に連動""]}, {""axis"": ""誤答傾向"", ""cols"": [""教育で講習代替"", ""記録省略""]}]",安全衛生教育の比較｜S33,教育制度は目的と対象で分けると整理しやすく、試験の混同肢を切り分けやすくなります。,雇入れ時教育;特別教育;技能講習;記録保存,安全衛生教育を実施したので技能講習が不要と誤解し、対象業務の義務を落とす誤りが生じる。,教育と講習は目的別に二本立てで覚える。,安全衛生教育;雇入れ時の安全衛生教育（安衛則35条）;安全衛生教育／特別教育／職長教育／技能講習,安全衛生教育の学習で最初に確認する点は？,安全衛生教育は条文上の定義、対象業務、義務主体、記録保存までを一連で押さえると得点が安定します。単語だけでなく手順順序を確認し、誤肢の逆張りに強くなることが重要です。 試験では雇入れ時教育をセットで確認してください。,頻出のひっかけは？,人数基準、実施周期、保存期間、委員会や選任主体の取り違えが頻出です。設問文の主語と対象業務を先に確定し、数値を最後に照合すると誤答を減らせます。 試験では雇入れ時教育をセットで確認してください。 誤答では安全衛生教育を実施したので技能講習が不要と誤解し、対象業務の義務を落とす誤りが生じる。に注意してください。,実務と試験を両立する覚え方は？,法令フローを「対象確認→実施→記録→事後措置」で統一し、過去問を同じ順序で色分けしてください。この方法で初見問題でも論点位置を素早く特定できます。 試験では雇入れ時教育をセットで確認してください。 誤答では安全衛生教育を実施したので技能講習が不要と誤解し、対象業務の義務を落とす誤りが生じる。に注意してください。,直前期の確認ポイントは？,比較表と数値一覧を毎日短時間で回し、誤答だけを再演習するのが効率的です。特に第一種は有害業務分野の取りこぼしが合否を分けるため、弱点範囲を残さないことが重要です。 試験では雇入れ時教育をセットで確認してください。
lead-job-measures-compare-s34,鉛健診と就業措置の比較,労働衛生,鉛;健康診断,鉛健診結果に基づく就業措置と通常運用の違いを比較して整理します。,健診判断;就業措置,"[{""axis"": ""健診"", ""cols"": [""特殊健康診断（鉛）"", ""所見を把握""]}, {""axis"": ""措置"", ""cols"": [""健康診断事後措置"", ""就業制限・配置調整""]}, {""axis"": ""記録"", ""cols"": [""健康診断個人票の保存（5年）"", ""記録の作成・保存（測定・健康診断・教育等）""]}, {""axis"": ""報告"", ""cols"": [""健康診断結果報告書（特殊・定期）"", ""必要時に提出""]}, {""axis"": ""誤答傾向"", ""cols"": [""健診と措置を分離"", ""保存年限の混同""]}]",鉛健診就業措置の比較｜S34,鉛健診は結果通知だけでなく就業措置まで一体で判断する問題が中心です。,鉛健診結果;就業措置;5年保存,健診結果通知で対応完了と誤解し、就業上措置と記録維持を後回しにする誤りが多い。,鉛健診は措置決定までを1セットで覚える。,特殊健康診断（鉛）;健康診断事後措置;健康診断個人票の保存（5年）,鉛健診就業措置で落としやすい論点は？,鉛健診就業措置は義務主体、実施タイミング、保存記録の3点が崩れやすい領域です。設問文の主語を固定してから数値を照合すると、逆転肢への耐性が上がります。 試験では鉛健診結果をセットで確認してください。 誤答では健診結果通知で対応完了と誤解し、就業上措置と記録維持を後回しにする誤りが多い。に注意してください。,実務寄りの覚え方は？,実務フローを「事前確認→実施→記録→事後措置」で統一し、過去問の選択肢を同順に並べ替えて演習してください。この手順で初見問題の取りこぼしが減少します。 試験では鉛健診結果をセットで確認してください。 誤答では健診結果通知で対応完了と誤解し、就業上措置と記録維持を後回しにする誤りが多い。に注意してください。,直前期に優先する復習は？,誤答したテーマのみを再演習し、同種のひっかけを連続で解く方法が最も効率的です。新規分野を増やすより、既存弱点の穴埋めを先に行ってください。 試験では鉛健診結果をセットで確認してください。 誤答では健診結果通知で対応完了と誤解し、就業上措置と記録維持を後回しにする誤りが多い。に注意してください。,本番での判断手順は？,対象業務を確定し、次に適用法令、最後に数値を確認する順が安定します。数値先行で読むと主語を見落としやすいため、順序を固定して対応してください。 試験では鉛健診結果をセットで確認してください。 誤答では健診結果通知で対応完了と誤解し、就業上措置と記録維持を後回しにする誤りが多い。に注意してください。
