slug,genre,title,meta_description,lead,priority,tags,author_name,author_profile,reviewer_name,reviewer_profile,fact_checked_at,primary_sources,original_note,user_intent,action_items,update_policy,last_reviewed_at,next_review_at,source_checked_at,content_status,revision_note,section_1_heading,section_1_body,section_2_heading,section_2_body,section_3_heading,section_3_body,section_4_heading,section_4_body,section_5_heading,section_5_body,section_6_heading,section_6_body,section_7_heading,section_7_body,faq_1_question,faq_1_answer,faq_2_question,faq_2_answer,related_links,faq_3_question,faq_3_answer,faq_4_question,faq_4_answer,key_points,sources
anzen-eisei-taisei,分野別対策,第一種衛生管理者·安全衛生管理体制【選任·専任·委員会】,第一種衛生管理者試験の安全衛生管理体制。選任義務·専任性·委員会設置を雇用者数·業種別表で具体例付き解説。法令（有害以外）基礎記事との2列比較も掲載。,"第一種衛生管理者試験の安全衛生管理体制は、関係法令（有害以外）20問の中核論点です。100問·180分（13:30〜16:30）·5科目×各20問·総合60％+各科目40％足切り·受験料8,800円。常時雇用者数·業種·有害業務の有無で選任義務·専任性·委員会設置が分岐します。100問中、法令40問のうち管理体制は5〜8問程度出題。本記事は選任·専任·委員会の分岐表と20問演習接続に特化します。例えば6/11（木）·10/13（日）試験まで残り18週なら6/14（土）分岐表作成→6/21（土）法令以外20問9/20、とセット。比較表1枚が定着の鍵です。",10,第一種衛生管理者;試験ガイド,一衛マスター編集部,第一種衛生管理者試験の学習コンテンツを整理する編集チーム,一衛マスター確認担当,公開前に公式情報と内部リンクを確認,2026-06-11,安全衛生技術試験協会（公式）|https://www.exam.or.jp/,手書きリライト 2026-06-05。自動prose差し替え 2026-06-04（要手書き）。旧 articles/*.html から移行。;retire_redirect:affiliate-beginner-material-set,本記事を読むと、たとえば9/7（日）選任混同3問なら比較表→9/14（日）解き直しできる進め方が分かり、法令（有害以外）基礎記事との使い分けも表で把握できます。,常時雇用者数×業種×有害の分岐表を作成する;選任·専任·委員会の3論点を比較表で整理する;安衛法第1〜3章読了後に法令以外20問を解く;混同論点は一問一答10問/日×3日で反復する;法令（有害以外）基礎記事とセットで学習する,試験要項・公式情報の改定時に見直す,2026-06-11,2026-06-29,2026-06-11,archived,2026-06-18: archived（guide retire p1·affiliate-beginner-material-setへ統合）,選任義務の分岐表,選任義務の主要分岐です。| 条件 | 義務 || --- | --- || 常時50人+ | 選任 || 常時300人+ | 専任等 || 有害業務 | 追加要件 || 建設業 | 特例 |たとえば9/7（日）演習10問中人数分岐誤答4問なら分岐表1枚→9/14（日）解き直し。数値は要項·テキストで最新確認。6/21（土）法令以外20問とセットで初回40％以上を確認。数値と期限記事と併用。,常時雇用者数と専任性,専任性の判断軸です。| 人数 | 要件 || --- | --- || 50〜299 | 選任 || 300+ | 専任 || 1000+ | 委員会等 |例えば6/14（土）第2章読了→6/21（土）法令以外20問、選任3問·専任2問と出題比率を記録。法令（有害以外）基礎記事と同章で並読。7/31（木）まで骨格章1周を目標にしてください。主体（事業者·労働者）も3列メモで整理。,安全衛生委員会の設置基準,委員会設置の分岐です。| 条件 | 設置 || --- | --- || 常時50人+ | 検討 || 常時100人+ | 設置義務 || 労使構成 | 半数等 |たとえば9/7（日）混同5問なら委員会比較表→9/14（日）解き直し3/5。8/31（日）まで分岐表1枚完成。9/1（月）から委員会10問/日×3日。関係法令勉強法記事で法令2科目40問も並行管理。,健診接続と20問演習フロー,法令·衛生の接点と演習への接続です。| 論点 | 法令 | 衛生 || --- | --- | --- || 健診周期 | 義務規定 | 実施管理 || 記録 | 保存期限 | 管理体制 || 選任 | 届出 | 計画 |例えば9/7（日）100問演習後健診保存5年 vs 30年を数値と期限記事と衛生（有害以外）基礎記事で横断。分岐表作成→第1〜3章読了→法令以外20問→混同解き直し、が定番フロー。40％未満なら2週解き直し優先。勉強の順番記事第1科目と一致。,法令（有害以外）基礎記事との2列比較表,管理体制特化と法令以外20問全体の基礎学習は2記事で分担します。本記事は選任·専任·委員会の分岐表·人数·業種特例·比較表の作り方、基礎記事は安衛法骨格·初回20問·8/20ライン·3列メモを説明します。| 論点 | 本記事（管理体制） | 基礎記事 || --- | --- | --- || 焦点 | 選任·委員会分岐 | 20問全体·骨格章 || 成果物 | 人数×業種分岐表 | 3列メモ·章対応表 || 時期 | 第1〜3章並読 | 独学第1科目 || 出口 | 頻出論点記事へ | 本記事へ |例えば6/21（土）基礎記事で初回9/20確認後、7/5（土）本記事で選任混同を深掘りする順が定番。2記事を混同すると分岐表だけで届出期限·保存年数が抜け、または骨格だけで人数分岐が弱いままです。法令以外頻出論点記事も併用。,,,,,人数の数値は全部暗記？,50·100·300等の分岐点を比較表1枚で管理。丸暗記より人数→義務の型。たとえば9/7（日）10問中人数誤答4問なら分岐表→9/14（日）解き直し。数値と期限記事と併用。8/31（日）まで分岐表1周完了。,基礎記事との違いは？,基礎記事は法令以外20問全体、本記事は選任·委員会に特化。たとえば初回20問後選任混同なら本記事、健診混同なら衛生（有害以外）基礎記事へ深掘り。2記事セット推奨。初回7/20なら基礎記事で2週解き直しを先に実施。,field-law-other-basics:法令（有害以外）基礎;kankei-hourei-benkyou:関係法令勉強法;field-eisei-other-basics:衛生（有害以外）基礎;numbers-and-deadlines:数値と期限;benkyou-junban:勉強の順番,建設業の特例は頻出？,建設業·運送業等は選任要件に特例が出題。たとえば9/14（日）100問で建設2問·一般3問と分類記録。業種列を比較表に追加。10/13（日）試験前に一問一答10問反復。9/15（火）建設選任5問を10問/日×3日で反復。,,,選任分岐;雇用者数;専任性;委員会;比較表,
benkyou-jikan,独学対策,第一種衛生管理者の勉強時間はどれくらい？1·2·3ヶ月の目安【80〜120時間】,第一種衛生管理者試験の勉強時間目安。初学者80〜120時間·週6〜10時間·1〜3ヶ月コース比較を具体例で整理し、勉強順番記事との2列比較を解説します。,第一種衛生管理者試験の勉強時間は、前提知識と週あたり確保できる時間で変わります。初学者の目安は80〜120時間。100問·180分（13:30〜16:30）·5科目×各20問·総合60％+各科目40％足切りを前提に、テキスト→科目別20問→100問の順で消化します。本記事は総時間·週次時間の逆算に特化します。例えば6/11（木）·10/13（日）試験まで残り18週なら、週7時間×18週＝126時間、が3ヶ月コースの定番です。1ヶ月（週20時間）·2ヶ月（週10時間）·3ヶ月（週7時間）の3パターンを表にまとめます。,20,第一種衛生管理者;試験ガイド,一衛マスター編集部,第一種衛生管理者試験の学習コンテンツを整理する編集チーム,一衛マスター確認担当,公開前に公式情報と内部リンクを確認,2026-06-11,安全衛生技術試験協会（公式）|https://www.exam.or.jp/,手書きリライト 2026-06-05。自動prose差し替え 2026-06-04（要手書き）。旧 articles/*.html から移行。;retire_redirect:affiliate-beginner-material-set,本記事を読むと、たとえば残り18週で126時間必要な場合に週7時間をカレンダー固定する根拠が分かり、40％未満科目が出た週の+2時間判断も把握できます。勉強順番記事との使い分けも表で確認できます。,試験日から逆算し残り週数×週次時間を計算する;初学者は80〜120時間を目標にカレンダー固定する;40％未満科目が出た週は+2時間を解き直しに充てる;2週間ごとに100問演習の正答率で時間配分を見直す;120時間超えても40％未満科目が残る場合は試験日延期を検討する,試験要項・公式情報の改定時に見直す,2026-06-11,2026-06-29,2026-06-11,archived,2026-06-18: archived（guide retire p1·affiliate-beginner-material-setへ統合）,初学者の総時間目安,経験別の総時間目安です。| 背景 | 時間目安 || --- | --- || 完全初学者 | 100〜120時間 || 第二種保有 | 60〜80時間 || 現場経験10年+ | 80〜100時間 || 再受験（50％台） | 40〜60時間 |たとえば完全初学者が6/14（土）開始·10/13（日）試験なら残り18週、120時間÷18＝週7時間。100問5科目すべて40％以上を180分で再現できるまで時間を追加してください。13:30〜16:30本番形式の記録も早めに開始します。,1·2·3ヶ月コース比較,残り期間別の週次時間です。| コース | 週数 | 時間/週 | 総時間 || --- | --- | --- | --- || 1ヶ月 | 4週 | 20〜25時間 | 80〜100時間 || 2ヶ月 | 8週 | 10〜12時間 | 80〜96時間 || 3ヶ月 | 12週 | 7〜10時間 | 84〜120時間 |例えば9/15（月）開始·10/13（日）試験の4週なら1ヶ月コース、週22時間（平日2h×5+土日6h）。8週未満で120時間必要なら試験日を1回後ろにずらす判断も検討してください。仕事しながら記事と平日上限も併用します。独学で足りるか迷う場合は、affiliate-dokugaku-goukaku-hokan で勉強時間の目安と講座が効くケースを先に確認すると教材投資の判断がしやすいです。,時間の内訳（120時間例）,120時間の配分例です。| 内容 | 時間 | 割合 || --- | --- | --- || テキスト5科目 | 40時間 | 33％ || 科目別20問初回 | 25時間 | 21％ || 100問·180分 | 30時間 | 25％ || 解き直し·一問一答 | 20時間 | 17％ || 直前·模試 | 5時間 | 4％ |たとえば8/31（日）時点でテキスト40時間消化済みなら、残り80時間を9〜10月の演習に集中。40％未満科目が出た週は解き直し比率を25％→35％へ一時引き上げます。演習問題量記事で週次問数も併用してください。,週次時間の記録表,週ごとに実績時間と演習結果を記録します。| 週 | 目標 | 実績 | 100問得点 | 最低科目 || --- | --- | --- | --- | --- || 9/7 | 8h | 7h | — | — || 9/14 | 8h | 9h | 55％ | 35％ || 9/21 | 10h | 10h | 62％ | 42％ |例えば9/14（日）週7hしか取れず55/100·35％なら、9/21（日）週10h（+2h解き直し）に増やします。実績が目標の80％未満が3週続くなら総時間120時間到達前でも試験日見直しを検討してください。合格基準記事で60％+40％も毎回照合します。,勉強順番記事との2列比較表,総時間逆算と5科目順序は2記事で分担します。勉強順番記事は5科目の推奨順·章→20問対応·100問移行条件、本記事は80〜120時間·週次時間·1〜3ヶ月コースの逆算と記録表を説明します。| 論点 | 本記事（勉強時間） | 勉強順番記事 || --- | --- | --- || 焦点 | 総時間·週次時間 | 5科目の順序 || 時期 | 計画開始直後 | 学習開始直後 || 成果物 | 週次記録表 | 5科目順リスト || 出口 | 3ヶ月計画へ | 100問通しへ |例えば6/7（土）本記事で週7時間×18週を確定後、6/14（土）勉強順番記事で5科目順をカレンダー登録する順が定番です。2記事を混同すると時間は確保しても科目順が曖昧なまま演習に入ってしまいます。3ヶ月学習計画記事で月次マイルストーンも併用してください。,,,,,最低何時間あれば受験できますか？,公式な最低時間はありません。実務上、完全初学者は80時間未満では5科目40％足切りの再現が難しいことが多いです。たとえば60時間で科目別初回のみ完了·100問通し未実施なら本番180分で時間切れリスクが高いです。80時間到達前の受験は、模試58/100以下なら延期を検討してください。,120時間超えても40％未満科目がある場合は？,時間の問題ではなく理解不足の信号です。新規演習を止め、当該科目のテキスト章+解き直し40問に2週間集中します。例えば120時間消化後も労働生理35％なら、試験日を次回月次回へずらし、労働生理に追加40時間が現実的な対処です。労働生理基礎記事と併用してください。,study-plan-3months:3ヶ月学習計画;study-plan-6months:6ヶ月学習計画;benkyou-junban:勉強順番;shukkin-dokugaku-jikan:仕事しながら;dokugaku-guide:独学合格ガイド;affiliate-dokugaku-goukaku-hokan:第一種衛生管理者は独学で合格できる？勉強時間の目安と通信講座が効くケース,1日何時間が上限ですか？,社会人は平日2時間·休日4〜6時間が継続可能な上限の目安です。1日8時間×7日の突撃は2週目以降の継続率が下がります。たとえば1ヶ月コースでも平日2h×5+土日6h＝週16時間を4週継続する方が、週末だけ20時間より総量が積み上がりやすいです。,,,80〜120時間;週6〜10時間;1〜3ヶ月;40％連動;逆算計算,
benkyou-junban,独学対策,第一種衛生管理者・勉強の順番【初学者5科目ロードマップ】,第一種衛生管理者試験の勉強順番。5科目の推奨順·章と20問演習の対応·100問移行条件を具体例で整理し、独学ガイド記事との2列比較を解説します。,第一種衛生管理者試験の勉強順番は、5科目をバラバラにせず「テキスト章→科目別20問」のセットで進めると定着しやすいです。定番は関係法令（有害以外）→労働衛生（有害以外）→関係法令（有害）→労働衛生（有害）→労働生理。100問·180分（13:30〜16:30）·5科目×各20問·総合60％+各科目40％足切りを前提に、本記事は5科目の学習順ロードマップに特化します。例えば6/11（木）·10/13（日）試験まで残り18週なら、6/14（土）法令以外章読了→6/21（土）法令以外20問9/20、が初回の定番フローです。100問通しは5科目初回40％以上後に移行してください。,30,第一種衛生管理者;試験ガイド,一衛マスター編集部,第一種衛生管理者試験の学習コンテンツを整理する編集チーム,一衛マスター確認担当,公開前に公式情報と内部リンクを確認,2026-06-11,安全衛生技術試験協会（公式）|https://www.exam.or.jp/,手書きリライト 2026-06-05。自動prose差し替え 2026-06-04（要手書き）。旧 articles/*.html から移行。;retire_redirect:affiliate-beginner-material-set,本記事を読むと、たとえば6/21（土）に法令以外20問9/20を確認した場合に次科目（衛生以外）へ進む条件が分かり、独学ガイド記事との使い分けも表で把握できます。,5科目の学習順リストをカレンダーに書く;テキスト該当章読了後に科目別20問を解く;40％以上で次科目·未満なら解き直し;5科目初回完了後に100問通しへ移行;2週間ごとに5科目正答率表で伸びを確認する,試験要項・公式情報の改定時に見直す,2026-06-11,2026-06-29,2026-06-11,archived,2026-06-18: archived（guide retire p1·affiliate-beginner-material-setへ統合）,5科目の推奨順序,初学者向けの科目順序です。| 順 | 科目 | 理由 || --- | --- | --- || 1 | 関係法令（有害以外） | 安衛法骨格 || 2 | 労働衛生（有害以外） | 管理体制 || 3 | 関係法令（有害） | 化学物質法令 || 4 | 労働衛生（有害） | 有害業務管理 || 5 | 労働生理 | 計算·温熱 |たとえば6/14（土）①20問→6/21（土）②20問、と週1科目で進めます。労働生理を最後にまとめると足切りリスクを早期検出しやすい反面、8/7（金）までに着手しないと時間不足になりやすいため計画表に開始日を固定してください。,テキスト章と演習の対応,各科目のテキスト章と20問演習の対応例です。| 科目 | テキスト章 | 演習 || --- | --- | --- || 法令以外 | 第1章安衛法 | 20問 || 衛生以外 | 管理体制章 | 20問 || 法令有害 | 化学物質章 | 20問 || 衛生有害 | 有害業務章 | 20問 || 労働生理 | 温熱·生理章 | 20問 |例えば6/14（土）は第1章読了→法令以外20問9/20。章未読で20問を解くと正答率30％台になり、初回40％ラインに届きません。13:30〜16:30·180分本番形式は5科目初回完了後に開始します。テキスト1冊は、affiliate-textbooks-recommend で出版社別の解説量を比較してから固定すると途中で変えずに済みます。初学者の第1冊は、affiliate-beginner-material-set でユーキャン速習·集中レッスン·これだけ覚えるの3冊を学習フェーズ別に比較してから固定すると、速習→本格テキストへの段階投入がぶれにくくなります。,18週ペースの逆算表,6/11開始·10/13試験の18週例です。| 期間 | 内容 || --- | --- || 6月 | 要項·教材·第1章 || 7月 | テキスト5科目 || 8月 | 科目別20問初回 || 9月 | 100問·180分 || 10月 | 模試·直前 |たとえば7/31（金）テキスト完了→8/28（金）五科目初回40％以上→9/28（日）最新100問65％、が各月末の出口判定です。最初の30日計画記事の第1〜4週と接続し、カレンダーに逆算日を書き込んでください。,順番を変えてよい場合,現場経験に応じて順序を調整できます。| 背景 | 調整 || --- | --- || 化学物質現場 | 法令有害·衛生有害を先 || 温熱現場 | 労働生理を③に || 第二種保有 | 差分科目優先 |例えば第二種からの受験なら第二種から第一種記事で差分を確認し、6/21（土）から労働生理20問→7月に法令、と逆順も可能です。足切りリスク科目は順序に関わらず40％ラインを最優先してください。各科目8/20足切りを毎回記録します。,独学ガイド記事との2列比較表,5科目順序と独学全体設計は2記事で分担します。独学ガイド記事は教材選定·学習環境·モチベーション·全体スケジュール、本記事は5科目の推奨順·章→20問対応·100問移行条件を説明します。| 論点 | 本記事（勉強順番） | 独学ガイド記事 || --- | --- | --- || 焦点 | 5科目の順序·出口 | 独学全体の設計 || 時期 | 学習開始直後 | 独学開始前後 || 成果物 | 5科目順リスト | 教材·環境チェック || 出口 | 100問通しへ | 本記事へ |例えば6/7（土）独学ガイド記事で教材·環境を整えた後、6/14（土）本記事で5科目順をカレンダー登録する順が定番です。2記事を混同すると教材は揃っても科目順が曖昧なまま100問に入ってしまいます。初学者向け学習計画記事で週次時間配分も併用してください。,,,,,テキスト全部読んでから過去問ですか？,科目ごとに「章→20問」が効率的です。全章読了後に100問は理解の鮮度が落ち、復習量が膨らみます。たとえば第1章後20問→第2章後20問の順が定番です。5科目すべて章+20問が終わってから100問通しに移行し、13:30〜16:30·180分で本番形式の記録を残してください。,労働生理を最初にやってもいいですか？,計算·温熱に自信があるなら③以降に前倒し可能です。ただし安衛法骨格なしで生理だけ先にやると、法令·衛生との関連がつながりにくいです。例えば温熱現場経験者は6/21（土）労働生理20問→7月に法令、と逆順も可能です。40％ラインを最優先してください。,dokugaku-guide:独学合格ガイド;self-study-start:独学の始め方;study-plan-beginner:初学者向け学習計画;first-30-days-plan:最初の30日;kankei-hourei-benkyou:関係法令勉強法;affiliate-textbooks-recommend:第一種衛生管理者のおすすめ参考書・テキスト3選【2026年度版・独学】;affiliate-beginner-material-set:第一種衛生管理者の初学者向け教材セット3選【速習・要点整理2026】,順番どおり進められない週は？,その週は1科目分だけでも前進させ、解き直し週を挟まないでください。例えば出張週は20問→10問+用語5語に縮小し、翌週20問解き直しします。2週空白が続くと18週計画が崩れるため、最小単位10問+5用語でもカレンダーにチェックを入れて継続してください。,,,5科目順序;章→20問;40％で次へ;18週ペース;100問は後半,
