slug,genre,title,meta_description,lead,priority,tags,author_name,author_profile,reviewer_name,reviewer_profile,fact_checked_at,primary_sources,original_note,user_intent,action_items,update_policy,last_reviewed_at,next_review_at,source_checked_at,content_status,revision_note,section_1_heading,section_1_body,section_2_heading,section_2_body,section_3_heading,section_3_body,section_4_heading,section_4_body,section_5_heading,section_5_body,section_6_heading,section_6_body,section_7_heading,section_7_body,faq_1_question,faq_1_answer,faq_2_question,faq_2_answer,related_links,faq_3_question,faq_3_answer,faq_4_question,faq_4_answer,key_points,sources
exam-purpose-and-career,試験概要,第一種衛生管理者試験の目的とキャリア【選任·100問5科目】,第一種衛生管理者試験の目的とキャリア。選任·現場管理·5科目100問の学習動機づけを具体例で整理し、合格後キャリア記事との2列比較を解説します。,"第一種衛生管理者試験は、事業場の労働衛生管理を担う国家資格の知識·能力を測る試験です。100問·180分（13:30〜16:30）·5科目×各20問·総合60％+各科目40％足切り·受験料8,800円を前提に、本記事は受験前の目的づけと5科目と業務の対応に特化します。合格後のキャリア設計は合格後キャリア記事で確認してください。例えば6/11（木）·10/13（日）試験まで残り18週なら、6/14（土）志望動機を記録→7月勉強順番記事で5科目開始、が定番の学習動機づけです。",10,試験概要;公式情報,一衛マスター編集部,資格学習サイトの編集チーム,公式情報確認担当,公開前に一次情報との照合を行う担当者,2026-06-11,安全衛生技術試験協会（公式）|https://www.exam.or.jp/,手書きリライト 2026-06-05。自動prose差し替え 2026-06-04（要手書き）。試験概要向けテンプレートから作成。公開前に本文・参照URL・関連リンクを差し替える。;retire_redirect:affiliate-beginner-material-set,本記事を読むと、たとえば9/7（日）100問62/100で5科目弱点と業務領域の対応が分かり、志望に合わせた科目優先順を設計できます。合格後キャリア記事との使い分けも表で把握できます。,5科目と業務領域の対応表1枚を作成する;試験ガイド記事で試験形式100問180分を確認する;仕事内容記事で合格後業務の全体像を把握する;100問演習で各科目8/20以上を目標にする;志望動機をカレンダーに書いて学習継続の錨にする,試験要項・公式ページ更新時に本文と参照元を見直す。,2026-06-11,2026-06-29,2026-06-11,archived,2026-06-18: archived（guide retire p1·affiliate-beginner-material-setへ統合）,試験の目的と位置づけ,国家資格としての役割です。| 項目 | 内容 || --- | --- || 目的 | 労働衛生管理 || 形式 | 100問筆記·マークシート || 時間 | 180分·13:30〜16:30 || 合格 | 総合60％+各40％足切り |たとえば6/14（土）に要項で100問·5科目·180分を確認し、試験ガイド記事で全体像を把握します。44問表記は旧情報なので100問に読み替えてください。第二種30問表記も第一種判断に使わないでください。,5科目と業務領域の対応,試験科目と現場業務の接続です。| 科目 | 業務領域の例 || --- | --- || 関係法令（有害） | 許容濃度·届出 || 関係法令（有害以外） | 選任·管理体制 || 労働衛生（有害） | 保護具·作業環境 || 労働衛生（有害以外） | 健康診断 || 労働生理 | 温熱·作業負荷 |例えば9/7（日）100問62/100·法令（有害以外）7/20なら安全衛生管理体制記事を9月優先40問にします。仕事内容記事で日常業務の詳細も併用してください。,学習動機づけの逆算,志望から科目優先順を逆算します。| 志望 | 優先科目 | 演習の接続 || --- | --- | --- || 健診管理 | 労働衛生（有害以外） | 健康診断記事 || 化学管理 | 法令·衛生（有害） | 化学物質記事 || 温熱管理 | 労働生理 | 温熱記事 || 選任·体制 | 法令（有害以外） | 管理体制記事 |たとえば6/14（土）·「選任後に健診管理」志望なら9/1（月）から健診関連20問を週2回追加します。各科目40％足切りは合格基準記事で毎回確認し、志望科目だけ優先しても他科目8/20未満は不合格です。,受験前に確認する5項目,独学開始前のチェック項目です。| 項目 | 確認内容 | 参照記事 || --- | --- | --- || 受験資格 | 要項該当区分 | 受験資格詳細 || 試験日 | 10/13等 | 試験日程 || 学習時間 | 80〜120h+ | 勉強時間の目安 || 志望動機 | 1行メモ | 本記事 || 演習環境 | 13:30タイマー | 問題形式 |例えば6/14（土）·資格○·10/13（日）確定·週8時間なら6/21（土）からテキスト開始、9/21（日）13:30 100問演習へ接続する流れが定番です。勉強順番記事で5科目の週次計画も併用してください。,career-after-qualification記事との2列比較表,受験前の動機づけと合格後のキャリア設計は2記事で分担します。本記事は試験の目的·5科目と業務の対応·学習動機づけ、合格後キャリア記事は合格後の選任·専任·他資格·昇進のロードマップを説明します。| 論点 | 本記事（目的とキャリア） | 合格後キャリア記事 || --- | --- | --- || タイミング | 受験前 | 合格後 || 焦点 | 目的·動機·業務対応 | キャリア設計 || 成果物 | 志望動機·対応表 | ロードマップ || 出口 | 仕事内容記事へ | 合格後手続記事へ |例えば6/14（土）に本記事で志望動機を書き、11/5（水）合格後に合格後キャリア記事で12/1（月）選任→専任→他資格の順を設計する流れが定番です。2記事を混同すると合格後の手続タイミングが抜けます。仕事内容記事で業務詳細も併せて確認してください。,,,,,試験前にキャリアを考える必要はありますか？,必須ではありませんが、学習継続の動機づけに有効です。たとえば9/7（日）100問62/100·「健診管理志望」なら9月労働衛生（有害以外）を週2×20問で優先します。合格基準は100問·各科目40％が先で、仕事内容記事と併用してください。100問後は5科目分けて記録します。,第二種とのキャリア差は何ですか？,第一種は選任要件·管理範囲が広く、試験も100問·5科目足切りです。たとえば第二種保有なら第二種から第一種記事で差分（有害40問·生理20問）を6月から優先確認します。類似資格比較記事で比較表1枚も作成してください。100問·180分は要項で毎年照合します。,career-after-qualification:合格後キャリア;eisei-kanrisha-gyoumu:仕事内容;shiken-guide:試験ガイド;goukaku-kijun:合格基準;benkyou-junban:勉強順番,合格後すぐ業務を始められますか？,選任·届出の後に業務開始が基本です。手続詳細は合格後手続記事で確認してください。たとえば10/13（日）合格→11/5（水）発表→12/1（月）選任、の流れが定番です。合格後のロードマップは合格後キャリア記事で設計し、各科目40％足切りは合格基準記事で試験前に確認します。,,,選任·現場管理;100問5科目;動機づけ;業務対応;要項照合,
first-time-exam-guide,試験概要,第一種衛生管理者·初めて受験する人向けガイド【100問5科目】,"第一種衛生管理者試験の初受験ガイド。100問180分·5科目足切り·8,800円·独学80〜120時間の全体像を具体例付き解説。試験ガイド記事との2列比較も掲載。","第一種衛生管理者試験を初めて受ける方は形式·資格·申込·学習を順に確認してください。本番100問·180分（13:30〜16:30）·5科目×各20問·合格総合60％+各科目40％足切り·受験料8,800円·希望日2か月前先着申込。本記事は初受験者向けの記事順·月次タイムライン·初回演習に特化します。例えば6/11（木）·10/13（日）試験まで残り18週·6/14（土）初受験準備開始なら要項→資格→申込→独学合格ガイドの5段階が定番。",10,試験概要;公式情報,一衛マスター編集部,資格学習サイトの編集チーム,公式情報確認担当,公開前に一次情報との照合を行う担当者,2026-06-11,安全衛生技術試験協会（公式）|https://www.exam.or.jp/,手書きリライト 2026-06-05。自動prose差し替え 2026-06-04（要手書き）。試験概要向けテンプレートから作成。公開前に本文・参照URL・関連リンクを差し替える。;retire_redirect:affiliate-beginner-material-set,本記事を読むと、たとえば6/14（土）初受験準備開始なら最初に読む記事順と8/14（木）申込前の確認が分かり、試験ガイド記事との使い分けも表で把握できます。,試験ガイド記事で100問5科目の全体像を把握する;受験資格記事で受験資格区分を自己判定する;希望試験日2か月前の申込開始日をカレンダー登録する;独学合格ガイドの5段階ロードマップに接続する;9月までに5科目×20問初回を完了する,試験要項・公式ページ更新時に本文と参照元を見直す。,2026-06-11,2026-06-29,2026-06-11,archived,2026-06-18: archived（guide retire p1·affiliate-beginner-material-setへ統合）,初受験前に知る5つの数字,"試験の基本ファクトです。| 項目 | 内容 || --- | --- || 問題数 | 100問 || 時間 | 180分 || 開始 | 13:30 || 合格 | 60％+足切り || 受験料 | 8,800円 |たとえば6/14（土）開始、5数字をメモ帳に保存。週8時間＝144時間が独学目安内。合格基準記事と併用。44問表記は旧情報です。

「初受験前に知る5つの数字」では、·初めて受験する人向けガイド【100問5科目】について公式テキストの該当章を開き、条文の主体・期限・数値を演習問題とセットで押さえて定着を確認します。数値・日程は安全衛生技術試験協会（公式）の最新要項で必ず照合してください。",初月に読む記事順,初受験者向けの記事導線です。| 順 | 記事 || --- | --- || 1 | 試験ガイド || 2 | 受験資格 || 3 | 公式情報確認先 || 4 | 勉強の順番 || 5 | 独学合格ガイド |例えば6/14（土）13:00〜15:00で試験ガイド·受験資格·公式情報確認先の3記事。8/14（木）申込前に申込の流れ記事を確認。9/14（日）100問演習開始。各科目8/20足切りを記録。独学で足りるか迷う場合は、affiliate-dokugaku-goukaku-hokan で勉強時間の目安と講座が効くケースを先に確認すると教材投資の判断がしやすいです。,申込·資格のタイムライン,10/13（日）試験想定の月次表です。| 月 | 作業 || --- | --- || 6月 | 要項·資格 || 7月 | テキスト || 8月 | 申込·20問 || 9月 | 100問 || 10月 | 直前 |たとえば8/14（木）申込開始、8/13（水）まで写真·資格、申込締切前チェックリストと併用。9/1（月）から180分演習月2回。試験直前1ヶ月·1週間記事も10月に接続。,初回演習の進め方,"過去問初回の鉄則です。| 段 | 条件 || --- | --- || 1 | テキスト章後 || 2 | 科目別20問 || 3 | 40％+で次科目 || 4 | 5科目後100問 |例えば7/5（土）法令章後、法令以外20問9/20→7/12（土）次科目。過去問初回記事と接続。40％未満は解き直し。616問は過去問出題傾向記事へ接続してください。

「初回演習の進め方」では、·初めて受験する人向けガイド【100問5科目】について公式テキストの該当章を開き、条文の主体・期限・数値を演習問題とセットで押さえて定着を確認します。数値・日程は安全衛生技術試験協会（公式）の最新要項で必ず照合してください。",試験ガイド記事との2列比較表,"初受験専用導線と試験全体像の入口は2記事で分担します。本記事は初受験者向け記事読み順·月次タイムライン·初回演習·直前接続、試験ガイド記事は要点一覧·受験フロー·5段階概要·開始前チェックを説明します。| 論点 | 本記事（初受験） | 試験ガイド記事 || --- | --- | --- || 焦点 | 初受験·記事順 | 概要·資格·申込 || 時期 | 準備開始直後 | 学習開始前 || 成果物 | 月次タイムライン | 開始前チェック表 || 出口 | 独学合格ガイドへ | 独学合格ガイドへ |例えば6/14（土）試験ガイド記事で100問·8,800円把握後、本記事で記事順·月次表を作成、6/21（土）独学合格ガイドへ、の順が定番。2記事を混同すると概要だけで初月の記事順が抜け、または導線だけで試験数値の確認が遅れます。試験当日の流れ記事も併用。",,,,,何から始める？,"試験協会要項→試験ガイド記事→受験資格記事、の順。たとえば6/14（土）2時間で3記事読了。100問·180分·5科目足切りをメモ。8,800円·2か月前申込をカレンダー登録。7月テキスト開始が定番です。",独学で間に合う？,80〜120時間目安内なら可能。たとえば18週×8時間＝144時間、独学合格ガイド5段階で消化。5科目初回20問→100問→180分模試。40％未満科目は週+2時間解き直し。9/1（月）から100問通し。,shiken-guide:試験ガイド;exam-eligibility:受験資格;moushikomi-nagare:申込の流れ;dokugaku-guide:独学ガイド;goukaku-kijun:合格基準;affiliate-dokugaku-goukaku-hokan:第一種衛生管理者は独学で合格できる？勉強時間の目安と通信講座が効くケース,44問と聞いたが？,旧情報です。現在は100問·5科目各20問。合格基準記事で照合。たとえば口コミ「44問中30」は100問中60に読み替え。616問は14回分バンク、1回本番100問。試験協会要項で毎年確認してください。,,,"初受験;100問;8,800円;2か月前;80〜120時間",
compare-similar-qualifications,試験概要,第一種衛生管理者と類似資格の比較【第二種·作業環境測定士】,第一種衛生管理者と第二種·作業環境測定士等の比較。試験形式100問180分·受験資格·学習ロードマップ差分と第二種から第一種記事との2列比較を具体例で整理します。,"第一種衛生管理者·第二種衛生管理者·作業環境測定士などは名称が近く混同されやすい資格です。第一種は100問·180分（13:30〜16:30）·5科目×各20問·総合60％+各科目40％足切り·受験料8,800円です（要項で再確認）。第二種合格だけでは第一種受験資格にはなりません。本記事は3資格の比較表とキャリア目的別の選び方に特化します。第二種から第一種への差分学習は第二種から第一種記事で確認してください。例えば6/11（木）·10/13（日）試験まで残り18週なら、6/14（土）に比較表1枚→受験資格記事で資格判定→7月学習開始、が定番の流れです。",10,試験概要;公式情報,一衛マスター編集部,資格学習サイトの編集チーム,公式情報確認担当,公開前に一次情報との照合を行う担当者,2026-06-11,安全衛生技術試験協会（公式）|https://www.exam.or.jp/,手書きリライト 2026-06-05。自動prose差し替え 2026-06-04（要手書き）。試験概要向けテンプレートから作成。公開前に本文・参照URL・関連リンクを差し替える。;retire_redirect:affiliate-beginner-material-set,本記事を読むと、たとえば6/14（土）に第二種保有と判明した場合に、比較表で試験形式·役割の違いを把握し、受験資格記事で第一種の自己判定へ進む手順が分かります。第二種から第一種記事との使い分けも表で把握できます。,第一種·第二種·作業環境測定士の3列比較表1枚を作成する;第一種受験資格は受験資格記事で自己判定する;第二種から第一種なら第二種から第一種記事に接続する;100問5科目·180分·40％足切りをメモに固定する;44問表記は100問に読み替えて学習計画を立てる,試験要項・公式ページ更新時に本文と参照元を見直す。,2026-06-11,2026-06-29,2026-06-11,archived,2026-06-18: archived（guide retire p1·affiliate-beginner-material-setへ統合）,主要資格の比較表,試験·役割の違いを3列比較表にまとめます。| 資格 | 問題数·時間 | 役割 || --- | --- | --- || 第一種衛生管理者 | 100問·180分 | 全業種選任 || 第二種衛生管理者 | 別形式 | 業種限定 || 作業環境測定士 | 別試験 | 測定専門 |たとえば6/14（土）に3列比較表1枚を作成し、10/13（日）試験まで残り16週なら6月末までに資格判定を完了するのが定番です。合格基準記事で100問·60％+40％足切りも確認し、44問表記は第一種100問に読み替えてください。,第二種から第一種への道,第二種保有者が第一種を目指すときの差分学習の要点です。| 項目 | 第二種→第一種 || --- | --- || 受験資格 | 別判定（第二種合格のみ不可） || 試験 | 100問·5科目 || 差分 | 有害40問+労働生理20問 || 時間 | 80〜120時間目安 |例えば7/7（日）に第二種から第一種記事の差分マップを確認し、7月は有害40問を集中演習します。受験資格記事で資格を先に確認し、13:30〜16:30·180分の本番形式で9月以降100問演習に移行してください。,作業環境測定士との関係,作業環境測定士との試験範囲の重なりです。| 論点 | 第一種 | 作業環境測定士 || --- | --- | --- || 粉じん | 有害40問の一部 | 専門深掘り || 化学物質 | 横断出題 | 専門試験 || 選任 | 第一種のみ | 対象外 |たとえば9/7（日）100問で粉じん6問だったら、粉じん·作業環境測定記事で演習を深掘りします。測定士保有でも第一種100問は別試験として受験します。5科目40％足切りを毎回記録してください。,キャリア目的での選び方,目的別の第一種の位置づけです。| 目的 | 第一種 | 代替候補 || --- | --- | --- || 全業種選任 | 必須 | — || 測定のみ | 不要 | 作業環境測定士 || 保健師現場 | 推奨 | 第一種+医療知識 || 業種限定管理 | 任意 | 第二種 |例えば6/14（土）に目的とキャリア記事で志望を確認し、本記事の比較表で第一種の必要性を判断し、7月から学習を開始する流れが定番です。100問通し演習は9月以降に入れ、独学合格ガイド記事の5段階ロードマップも併用してください。,nishu-kara-ichishu記事との2列比較表,類似資格の全体比較と第二種→第一種の差分学習は2記事で分担します。本記事は第一種·第二種·測定士の3列比較とキャリア目的別の選び方、第二種から第一種記事は有害40問·労働生理20問の差分マップと月次配分を説明します。| 論点 | 本記事（類似資格比較） | 第二種から第一種記事 || --- | --- | --- || 焦点 | 3資格の比較表 | 差分40問·生理20問 || 対象 | 資格選択·全体像 | 第二種保有者 || 成果物 | 比較表1枚 | 差分リスト·月次表 || 出口 | 受験資格記事へ | 100問180分演習へ |例えば6/14（土）に本記事で比較表を作り、第二種保有が判明したら第二種から第一種記事で7月有害40問集中の月次表へ進む順が定番です。2記事を混同すると差分論点の優先配分が抜けます。併願·同日受験記事で日程衝突も併せて確認してください。,,,,,第二種だけで第一種を受験できますか？,不可です。第二種合格は第一種受験資格になりません。学歴·実務で別判定が必要です。たとえば6/14（土）に受験資格記事で確認し、第二種から第一種記事で差分学習へ進んでください。100問·5科目·180分で学習計画を組み、10/13（日）まで残り16週なら7月に有害40問を集中します。,44問の資格情報と混同しませんか？,"44問は旧情報·別試験混同です。第一種は100問·5科目各20問です。たとえば口コミ「44問試験」は100問·180分に読み替えてください。合格基準記事で足切りも確認し、要項で毎年再確認してください。13:30〜16:30開始·受験料8,800円·2か月前申込。",nishu-kara-ichishu:第二種から第一種;juken-shikaku:受験資格;shiken-guide:試験ガイド;goukaku-kijun:合格基準;exam-purpose-and-career:試験目的,複数資格の学習順はどう決めますか？,目的資格を1つ先に確定します。たとえば第一種目標なら比較表→受験資格記事→勉強の順番記事の順が定番です。測定士との並行学習は時間分散に注意してください。100問·40％足切りの演習を優先し、10/13（日）まで残り12週なら9/1（月）から100問通しを開始します。,,,第一種;第二種;100問;資格別;比較表,
